Category,Count,Theme,NPC Receiver,Glyph,Location,Storyline
Transcendence,1,"coherence of Loss",Ravi & Nima,Glyph of Contained Loss,Triglyph Chamber (Civic Center Ruins),"This fusion glyph is created when the player combines three glyphs: Glyph of Sorrow, Glyph of Remembrance, and Glyph of Legacy. These three glyphs unlock access to the Triglyph Chamber, a Corelink emotional server housing 'The Witnessed Crown'—a boss shaped like a weeping, crowned figure that turns away in shame. The player defeats this boss not through combat, but through witnessing: by positioning themselves to see the boss's eye and honoring its grief. When defeated, the boss dissolves into the Glyph of Contained Loss. Behind the victory console, the player sees a faint vision: young Velinor playing with Ophina in the marketplace, laughing and chasing through the stalls. FINAL CHOICE: Take the glyph (massive empathy boost) or Leave the glyph (smaller empathy boost + trust with Ravi/Nima)."
Transcendence,2,"coherence of Abandonment",Coren the Mediator,Glyph of Transmuted Abandonment,Octoglyph Chamber (Chamber of Severed Echoes),"This fusion glyph is created when the player combines eight glyphs: Infrasensory Oblivion (Ache/Saori), Sensory Oblivion (Presence/Desert Listener), Primal Oblivion (Ache/Mourning Singer), Dislocated Attachment (Ache/Archivist of Lineage), Preemptive Severance (Collapse/Cult Adjudicator), Interruptive Restraint (Sovereignty/Trial Warden), Held Ache (Sovereignty/Mediator), and Hopeful Transmission (Legacy/Street Performer). These glyphs unlock access to the Octoglyph Chamber, a Corelink server housing 'The Severed Choir'—a boss formed of eight voices screaming in dissonance. The player defeats this boss by aligning the voices into resonance, holding silence until they harmonize. When defeated, the boss dissolves into the Glyph of Transmuted Abandonment. Behind the console, the player sees a vision: Velinor and Saori arguing, then embracing briefly before the collapse. FINAL CHOICE: Take the glyph (massive empathy boost) or Leave the glyph (smaller empathy boost + trust with Mediator)."
Transcendence,3,"coherence of Sovereignty",Captain Veynar,Glyph of Disciplined Boundaries,Pentaglyph Chamber (Desert Trial Grounds),"This fusion glyph is created when the player combines five glyphs: Reckless Trial (Sovereignty/Dalen), Iron Boundary (Sovereignty/Veynar), Measured Step (Sovereignty/Malrik), Hidden Passage (Sovereignty/Kaelen), and Covenant Flame (Trust/Elenya). These glyphs unlock access to the Pentaglyph Chamber, a Corelink server housing 'The Lawbound Sentinel'—a boss shaped like a shifting wall of sand and iron. The player defeats this boss by marking boundaries in the arena, forcing the Sentinel to collapse into defined space. When defeated, the boss dissolves into the Glyph of Disciplined Boundaries. Behind the console, the player sees a vision: Velinor carving a circle in the sand, whispering 'this far, no further.' FINAL CHOICE: Take the glyph (massive empathy boost) or Leave the glyph (smaller empathy boost + trust with Veynar)."
Transcendence,4,"coherence of Presence",Shrine Healer,Glyph of Witnessed Silence,Hexaglyph Chamber (Shrine Healing Alcove),"This fusion glyph is created when the player combines six glyphs: Listening Silence (Presence/Korrin), Tender Witness (Presence/Shrine Healer), Echo Communion (Presence/Glyph Console Worshipper), Steadfast Witness (Presence/Community Storyteller), Emotional Inheritance (Legacy/Shrine Elder), and Widow's Cry (Ache/Desert Widow). These glyphs unlock access to the Hexaglyph Chamber, a Corelink server housing 'The Silent Choir'—a boss shaped like a faceless figure surrounded by echoes. The player defeats this boss by refusing to speak, holding silence until the echoes dissolve. When defeated, the boss dissolves into the Glyph of Witnessed Silence. Behind the console, the player sees a vision: Velinor sitting in silence beside survivors, her halo dim but steady. FINAL CHOICE: Take the glyph (massive empathy boost) or Leave the glyph (smaller empathy boost + trust with Shrine Healer)."
Transcendence,5,"coherence of Joy",Sera the Herb Novice,Glyph of Communal Resurrection,Heptaglyph Chamber (Shrine Garden),"This fusion glyph is created when the player combines seven glyphs: Laughter's Balm (Joy/Sera), Shared Feast (Joy/Market Cooks), Hidden Warmth (Joy/Forest Camper), Arrival (Joy/Dock Worker), Crafted Wonder (Joy/Boatmaker), Returning Song (Legacy/Mourning Singer), and Whispered Pact (Trust/Korrin). These glyphs unlock access to the Heptaglyph Chamber, a Corelink server housing 'The Reveler's Mask'—a boss shaped like a shifting festival mask, laughing and crying at once. The player defeats this boss by joining its dance, refusing despair, and sustaining joy through movement. When defeated, the boss dissolves into the Glyph of Communal Resurrection. Behind the console, the player sees a vision: Velinor laughing with Saori during the Corelink’s design, joy before collapse. FINAL CHOICE: Take the glyph (massive empathy boost) or Leave the glyph (smaller empathy boost + trust with Sera)."
Transcendence,6,"coherence of Trust",Mariel the Weaver,Glyph of Interwoven Bonds,Tetraglyph Chamber (Shrine Loom),"This fusion glyph is created when the player combines four glyphs: Shared Burden (Trust/Tovren), Binding Cloth (Trust/Mariel), Weary Justice (Trust/Veynar), and Mutual Passage (Trust/Ferry Operator & Dock Worker). These glyphs unlock access to the Tetraglyph Chamber, a Corelink server housing 'The Fractured Bridge'—a boss shaped like a collapsing span held by fraying ropes. The player defeats this boss by weaving threads across the arena, binding the bridge together until it stabilizes. When defeated, the boss dissolves into the Glyph of Interwoven Bonds. Behind the console, the player sees a vision: Velinor holding hands with strangers across a broken bridge, refusing to let go. FINAL CHOICE: Take the glyph (massive empathy boost) or Leave the glyph (smaller empathy boost + trust with Mariel)."
Transcendence,7,"coherence of Collapse",Archivist Malrik,Glyph of Accepted Uncertainty,Hexaglyph Chamber (Archive Ruins),"This fusion glyph is created when the player combines six glyphs: Fractured Memory (Collapse/Malrik), Mirage Echo (Collapse/Malrik), Venomous Choice (Sovereignty/Drossel), Masked Boundary (Sovereignty/Drossel), Broken Vessel (Ache/Clay Hermit), and Hidden Ache (Ache/Mask-Maker). These glyphs unlock access to the Hexaglyph Chamber, a Corelink server housing 'The Shattered Archive'—a boss shaped like a glitching tower of records, constantly shifting. The player defeats this boss by refusing false paths, choosing uncertainty, and stabilizing fragments into acceptance. When defeated, the boss dissolves into the Glyph of Accepted Uncertainty. Behind the console, the player sees a vision: Velinor walking through mirages, smiling faintly as she accepts the unknown. FINAL CHOICE: Take the glyph (massive empathy boost) or Leave the glyph (smaller empathy boost + trust with Malrik)."